term,meaning,example
connoisseur,鑑定家,He is a connoisseur of fine wine.
connote,含意する,The word agile connotes a certain flexibility.
connote,含意する,The word home can connote warmth and safety.
connote,含意する,The word connotes a sense of urgency.
conscious,意識して,He is conscious of his surroundings.
conscious,意識している,He is conscious of the risks.
consecutive,連続した,He has won the award for three consecutive years.
consecutive,連続した,He won for the fifth consecutive year.
consecutive,連続した,He won the award for the third consecutive year.
consensus,合意,The team reached a consensus on the new plan.
consensus,合意,We need to reach a consensus before we proceed.
consensus,合意,We reached a consensus.
consent,同意する,She consented to the plan.
consequence,結果,The consequence of his actions was severe.
consequence,結果,The consequence of the decision.
consequence,結果,The decision had a serious consequence.
consequent,結果として生じる,例文なし
consequential,結果として生じる,The decision had consequential implications.
consequential,結果として生じる,The meeting was of consequential importance.
consequential,結果として生じる,There were many consequential effects of the new law.
conserve,節約する,We must conserve our resources for future projects.
conserve,節約する,We need to conserve energy in the office.
conserve,節約する,We need to conserve energy.
conserve,節約する,We need to conserve our resources.
conserve,節約する,We should conserve water.
conserve,保存する,例文なし
consider,検討する,Consider all options.
consider,検討する,We need to consider all the options carefully.
consider,検討する,We need to consider all options.
consider,考える,I will consider your proposal.
consider,考える,例文なし
considerable,かなりの,例文なし
considerably,かなり,Our profits have increased considerably.
consideration,考慮,Thank you for your consideration.
consign,委託する,He consigned the goods to a local dealer.
consign,委託する,The goods were consigned to the distributor.
consignment,委託,The goods are shipped on consignment.
consist,〜から成る,The team consists of ten people.
consist,〜から成る,例文なし
consistent,一貫した,His performance has been consistent.
consistent,一貫した,The results are consistent with our expectations.
consistent,一貫した,The results are consistent.
consistent,一貫した,The sales figures have been consistent for the last three months.
consistent,一貫した,We need a consistent approach to our work.
consistent,一貫性のある,例文なし
consolidate,統合する,We need to consolidate our assets.
consolidate,統合する,例文なし
consortium,共同事業体,The two companies formed a consortium to bid on the project.
conspicuous,目立つ,The error was conspicuous.
conspicuous,目立つ,The new logo is very conspicuous.
conspicuous,目立つ,The sign was conspicuous.
conspicuous,目立つ,The sign was very conspicuous.
constant,絶え間ない,He is under constant pressure.
constant,絶え間ない,The constant pressure.
constant,絶え間ない,例文なし
constitute,構成する,The members constitute the committee.
constitute,構成する,The new members constitute the majority of the board.
constitute,構成する,These parts constitute the engine.
constrain,制約する,The budget constrained the project.
constrain,制約する,The budget will constrain our project.
constrain,制約する,例文なし
constraint,制約,We are operating under tight budget constraints.
construct,建設する,They will construct a new building.
construct,建設する,例文なし
construct,構築する,We need to construct a new building.
construe,解釈する,His words were misconstrued.
consult,相談する,You should consult a professional for advice.
consult,相談する,You should consult an expert before making a decision.
consult,相談する,You should consult a lawyer.
consult,相談する,You should consult a specialist before making a decision.
consult,相談する,You should consult a specialist.
consultant,コンサルタント,We hired a marketing consultant.
consultant,コンサルタント,We hired a marketing consultant.
consultant,コンサルタント,例文なし
consume,消費する,We consume a lot of electricity.
consume,消費する,We consume a lot of paper.
consume,消費する,例文なし
consumer,消費者,Consumer behavior has changed.
consumer,消費者,The survey gathered feedback from over 1,000 consumers.
consumer,消費者,例文なし
consummate,完璧な,He is a consummate professional.
consumption,消費,Electricity consumption has increased.
contact,接触する,例文なし
contact,連絡する,Contact me later.
contact,連絡する,Please contact me if you have any questions.
contact,連絡する,Please contact me if you have any questions.
contact,連絡する,Please contact me.
contact,連絡する,例文なし
contain,含む,The box contains a book.
contain,含む,The box contains five apples.
contain,含む,The report contains all the key information.
contain,含む,The report contains a lot of data.
contain,含む,例文なし
contaminate,汚染する,例文なし
contemplate,熟考する,He contemplated the future.
contemplate,熟考する,I need to contemplate the decision.
contemplate,熟考する,We should contemplate the pros and cons of the decision.
contemporaneous,同時代の,The two events were contemporaneous.
contemporary,現代の,例文なし
contempt,軽蔑,He has contempt for lazy people.
contemptuous,軽蔑的な,He has a contemptuous attitude towards his rivals.
contend,主張する,He contends that the new policy is unfair.
contend,主張する,He contends that the new regulations are unfair.
content,コンテンツ,Content is king in marketing.
content,内容,The content of the website needs to be updated.
content,内容,The content of the email is not appropriate.
content,内容,The content of the report.
contentious,議論を呼ぶ,This is a contentious issue.
contest,異議を唱える,He contested the decision.
context,文脈,The quote was taken out of context.
context,文脈,You need to consider the context.
context,文脈,例文なし
contiguous,隣接した,The two offices are contiguous.
contiguous,隣接した,The two states are contiguous.
contingency,不測の事態,We have a contingency plan in case of a problem.
contingent,〜次第である,The project's success is contingent on the new funding.
contingent,付随的な,The bonus is contingent on sales targets.
contingent,付随的な,The plan is contingent on the funding.
continue,続ける,Continue working.
continue,続ける,Please continue your work.
continue,続ける,We will continue this discussion at the next meeting.
continue,続ける,We will continue the project.
continue,続ける,例文なし
contract,契約,Please read the contract carefully before signing.
contract,契約,We signed a contract.
contract,契約,We signed the contract.
contract,契約,例文なし
contractor,請負業者,We hired a contractor to build the new office.
contradict,矛盾する,His statement contradicts the evidence.
contradict,矛盾する,His statement contradicted the facts.
contradict,矛盾する,His statement contradicts his actions.
contradict,矛盾する,例文なし
contrary,反対の,On the contrary, he is wrong.
contrast,対照,The contrast between the two.
contravene,違反する,His actions contravene the company's code of ethics.
contravene,違反する,The new policy will contravene the existing labor laws.
contribute,貢献する,He contributed a lot to the team's success.
contribute,貢献する,He contributed to the project.
contribute,貢献する,We all contributed to the success of the project.
contribute,貢献する,We should all contribute to the team's success.
contribute,貢献する,例文なし
contribution,貢献,Your contribution to the project was very valuable.
contrive,考案する,He contrived a plan to escape.
contrive,考案する,He contrived a plan to increase efficiency.
control,管理,He is in control.
control,管理,She has control over the project.
control,管理,She is in control of the entire department.
control,管理する,He controls the budget.
control,制御する,He can control his emotions.
control,制御する,例文なし
controversy,論争,例文なし
contumacious,反抗的な,He was a contumacious employee.
contumely,侮辱,He was subjected to contumely.
convene,招集する,The board will convene a special meeting.
convene,招集する,The committee will convene next week.
convene,招集する,例文なし
convenience,利便性,The hotel's location offers great convenience.
convenient,便利な,It is more convenient to have the meeting online.
convenient,便利な,The location is convenient.
convenient,便利な,This is a convenient location.
convention,慣習,It is a common convention in the industry.
convention,大会,The annual sales convention will be held in Osaka.
convention,大会,The company attended a trade convention.
conventional,従来の,This is a conventional approach.
converge,収束する,The interests of the two companies began to converge.
converge,収束する,The two companies' interests began to converge.
converge,収束する,The two strategies will converge into one.
converge,収束する,例文なし
conversation,会話,We had a long conversation.
converse,話す,We conversed for a long time.
convert,転換する,例文なし
convert,変換する,Can you convert this file?
convert,変換する,We need to convert the data.
convey,伝える,Please convey my regards to your colleagues.
convey,伝える,Please convey my message to him.
convince,納得させる,He convinced me to join.
convince,納得させる,I couldn't convince him.
convince,納得させる,I tried to convince him to change his mind.
convince,納得させる,例文なし
convivial,陽気な,The atmosphere was convivial.
convivial,陽気な,The office party was a convivial affair.
cook,料理する,I like to cook.
cookie,クッキー,This website uses cookies to personalize your experience.
cookie,クッキー,This website uses cookies.
cooking,料理,Cooking is my hobby.
cool,涼しい,It's cool today.
cooperate,協力する,We need to cooperate with the marketing team.
cooperate,協力する,We need to cooperate to finish the task.
cooperate,協力する,We need to cooperate with each other.
cooperate,協力する,We need to cooperate.
cooperate,協力する,例文なし
cooperation,協力,Your cooperation is essential for the project's success.
coordinate,調整する,He is responsible for coordinating the event.
coordinate,調整する,I need to coordinate the schedules of all team members.
coordinate,調整する,We need to coordinate our efforts.
coordinate,調整する,例文なし
copious,豊富な,He took copious notes during the meeting.
copious,豊富な,She took copious notes.
copy,コピー,Make a copy of the document.
copyright,著作権,The song is under copyright.
corner,角,The corner of the street.
corollary,当然の結果,Increased profits are a corollary of the new strategy.
corporate,企業の,Corporate culture is important for employee satisfaction.
corporate,企業の,Corporate culture.
corporate,企業の,The company has a strong corporate culture.
corporate,企業の,This is a corporate event.
corporate,企業の,例文なし
corporeal,実体の,The company's corporeal assets include its buildings and equipment.
corporeal,肉体の,The corporeal assets of the company were sold.
corpulent,肥満の,The corpulent businessman was always out of breath.
correct,正しい,The answer is correct.
correspond,一致する,The data corresponds to the report.
correspond,一致する,例文なし
correspond,対応する,例文なし
correspondence,通信,I have a lot of business correspondence to handle.
corroborate,裏付ける,The data in the report corroborated the findings of the study.
corroborate,裏付ける,The evidence corroborated his testimony.
corroborate,裏付ける,The evidence will corroborate his testimony.
corroborate,裏付ける,The witness's statement corroborated the police report.
corrode,腐食する,例文なし
corrupt,腐敗した,The company is corrupt.
cost,費用,The cost is too high.
cost,費用,The total cost of the project is 1 million dollars.
cost,費用,We need to reduce our operating costs.
cost,費用,What is the total cost?
cost,費用,例文なし
coterie,仲間,He belongs to a coterie of artists.
coterie,仲間,He belongs to a coterie of influential executives.
could,〜できた,I could swim when I was 5.
could,〜できた,I could swim when I was five.
could,〜できた,例文なし
council,評議会,The city council is discussing the new law.
counsel,助言,例文なし
counsel,助言する,He counseled me on my career.
count,数える,Count the money.
count,数える,I need to count the number of products.
count,数える,Please count the number of people.
counter,カウンター,Please pay at the front counter.
counter,対抗する,He tried to counter my argument.
counter,対抗する,We need to counter the opposition's argument.
counterfeit,偽造する,He was arrested for counterfeiting money.
countermand,取り消す,He countermanded the order.
countermand,取り消す,He countermanded the previous order.
counterpart,対応する人,He is my counterpart in the other office.
counterpart,対応する人,I will meet with my counterpart from the UK office.
country,国,Which country are you from?
country,国,Which country are you from?
country,国,例文なし
couple,カップル,A happy couple.
couple,カップル,They are a happy couple.
couple,カップル,例文なし
courage,勇気,He has a lot of courage.
courage,勇気,He showed great courage.
courier,宅配業者,We sent the documents by courier service.
course,コース,A history course.
course,コース,I am taking a language course.
course,コース,例文なし
court,法廷,He went to court.
court,法廷,例文なし
covenant,契約,The contract contains a non-compete covenant.
covenant,契約,They signed a covenant to not compete.
covenant,契約,They signed a covenant.
covenant,誓約,The contract contains a non-compete covenant.
cover,扱う,The report covers all aspects of the project.
cover,含む,The report covers all topics.
cover,覆う,Cover the food.
cover,覆う,Please cover the food.
cover,覆う,例文なし
covert,秘密の,They conducted a covert investigation.
covert,秘密の,They conducted a covert operation.
crash,クラッシュ,My computer crashed.
cravat,ネクタイ,He wore a silk cravat.
create,創造する,Create a new document.
create,創造する,She wants to create a beautiful painting.
create,創造する,We need to create a new marketing plan.
create,創造する,We need to create a new product.
create,創造する,例文なし
creative,創造的な,A creative person.
credence,信用,I don't give credence to his story.
credential,資格,He has the necessary credentials for the job.
credential,資格,You need to have the right credentials for this job.
credentials,資格,He has excellent credentials.
credible,信頼できる,He is a credible source of information.
credit,信用,He has good credit.
credit,信用,You can pay by credit card.
credit,信用,例文なし
creditor,債権者,例文なし
credulous,騙されやすい,He is too credulous to be a good investor.
credulous,騙されやすい,He is too credulous.
crescendo,だんだん強くなる,The discussion reached a crescendo.
crime,犯罪,A serious crime.
crime,犯罪,He was arrested for a crime.
crime,犯罪,例文なし
crisis,危機,A financial crisis.
criteria,基準,We need to establish clear criteria for evaluation.
criteria,基準,We use a set of criteria to evaluate the proposals.
criteria,基準,We use specific criteria to evaluate candidates.
criteria,基準,例文なし
criterion,基準,What is the criterion for success?
critical,危機的な,The situation is critical.
critical,重要な,This is a critical moment.
criticize,批判する,He criticized the plan.
criticize,批判する,It's not helpful to criticize without offering a solution.
cross,横断する,Cross the street carefully.
cross,渡る,He wants to cross the river.
crowd,群衆,A large crowd.
crowd,群衆,The crowd was cheering loudly.
crucial,極めて重要な,This is a crucial decision for our business.
crucial,極めて重要な,This is a crucial point for our business.
crucial,極めて重要な,例文なし
crucial,決定的な,The next meeting is crucial for the project's future.
crucial,重要な,The decision is crucial.
crucial,重要な,This is a crucial decision.
cry,泣く,The baby is crying.
cryptocurrency,暗号通貨,Bitcoin is a popular cryptocurrency.
cryptocurrency,暗号通貨,He invests in various cryptocurrencies.
crystal,結晶,例文なし
culminate,最高潮に達する,The concert culminated in a spectacular fireworks display.
culminate,最高潮に達する,The project culminated in a successful product launch.
culminate,最高潮に達する,The project culminated in success.
culminate,最高潮に達する,The project will culminate in a major product launch.
culminate,最高潮に達する,The project will culminate in a product launch.
culpable,非難されるべき,The manager was found culpable for the project's failure.
culpable,有罪の,He was held culpable for the accident.
culpable,有罪の,The manager was culpable for the error.
cultivate,育てる,He wants to cultivate a positive work environment.
cultivate,育てる,We cultivate our own vegetables.
cultural,文化的な,例文なし
culture,文化,I am interested in Japanese culture.
culture,文化,Japanese culture.
culture,文化,The company culture is good.
culture,文化,例文なし
culvert,暗渠,The water flowed through a culvert.
cup,カップ,A cup of tea.
cup,カップ,例文なし
currency,通貨,The exchange rate of the local currency is volatile.
currency,通貨,例文なし
current,現在の,The current situation.
current,現在の,What is your current address?
current,現在の,例文なし
cursor,カーソル,The cursor is blinking.
curtail,削減する,We had to curtail our spending due to budget cuts.
curtail,削減する,We need to curtail our non-essential spending.
curtail,削減する,We need to curtail our spending on non-essential items.
curtail,削減する,We need to curtail our spending.
custom,慣習,It is a long-standing custom.
customary,慣例の,It is customary to send a thank-you note.
customary,習慣的な,It is customary to shake hands.
customer,顧客,A loyal customer.
customer,顧客,The customer service is excellent.
customer,顧客,例文なし
customize,カスタマイズする,You can customize the product.
customs,税関,例文なし
cut,切る,Cut the paper.
cut,切る,Please cut the paper.
cut,切る,例文なし
cutback,削減,The company announced a budget cutback.
cycle,周期,例文なし
cylinder,シリンダー,例文なし
cynical,皮肉な,He has a cynical view of corporate ethics.
cynical,皮肉な,He is a cynical person.
dad,お父さん,My dad is a doctor.
damage,損害,The fire caused a lot of damage.
damage,損害,The storm caused a lot of damage to the building.
damage,損害,The storm caused damage.
dance,踊る,I love to dance.
danger,危険,He is in danger.
danger,危険,The danger is real.
dark,暗い,It is dark outside.
dark,暗い,It's dark outside.
dark,暗い,例文なし
dashboard,ダッシュボード,The sales dashboard provides a real-time overview.
data,データ,We need to analyze the data.
data,データ,例文なし
database,データベース,All the customer information is in the database.
database,データベース,The company's customer database.
database,データベース,The customer database is stored on a secure server.
date,日付,What is the date today?
date,日付,What is the due date for the report?
date,日付,What is today's date?
daughter,娘,My daughter is 10.
daughter,娘,She has a beautiful daughter.
daughter,娘,例文なし
day,日,I will see you tomorrow.
day,日,What a beautiful day!
day,日,例文なし
dead,死んだ,The plant is dead.
dead,死んだ,例文なし
deadline,締め切り,The deadline is next week.
deadline,締め切り,The deadline is tomorrow.
deadline,締め切り,We have a strict deadline for this project.
deadline,締め切り,例文なし
deal,扱う,I can deal with the problem.
deal,扱う,We need to deal with the problem.
deal,取引,They made a deal on the price.
deal,取引,We are close to finalizing the deal.
deal,取引,例文なし
dear,親愛なる,Dear John.
dearth,不足,There is a dearth of qualified applicants for this position.
dearth,不足,There is a dearth of qualified applicants.
dearth,不足,There is a dearth of skilled workers.
death,死,The cause of death.
death,死,例文なし
debacle,大失敗,The product launch was a complete debacle.
debacle,大失敗,The project was a complete debacle.
debase,品質を下げる,The company's reputation was debased by the scandal.
debase,品質を下げる,The currency was debased.
debate,議論,The debate was long.
debate,議論する,例文なし
debate,討論,A political debate.
debate,討論,We had a long debate.
debauchery,放蕩,The CEO's debauchery led to his downfall.
debilitate,弱体化させる,The illness debilitated him.
debilitate,弱体化させる,The lack of funding will debilitate the entire project.
debilitate,弱体化させる,The lack of funding will debilitate the project.
debilitate,弱体化させる,The poor economy debilitated the business.
debt,借金,He has a lot of debt.
debt,借金,例文なし
debug,デバッグ,He is debugging the code.
debunk,正体を暴く,The report debunks the myth of easy success.
debunk,正体を暴く,The report debunks the myth.
decadence,退廃,The company's demise was a result of decadence.
decay,腐敗する,例文なし
deceive,だます,He deceived me.
decide,決める,I decided to quit my job.
decide,決める,I will decide later.
decide,決める,We need to decide now.
decide,決める,例文なし
decimate,大幅に減少させる,The recession decimated the workforce.
decision,決定,A difficult decision.
decision,決定,Making the right decision is important.
decision,決定,That was a difficult decision.
decision,決定,We need to make a decision.
decision,決定,例文なし
declaim,朗読する,He declaimed his resignation speech.
declaim,朗読する,He declaimed the poem.
declare,宣言する,The company declared bankruptcy.
decline,減少,Sales are in decline.
decline,減少,There has been a decline in sales this quarter.
decline,減少,There has been a decline in sales.
decline,減少,例文なし
decline,減少する,Sales have declined over the past year.
decline,減少する,The population is starting to decline.
decline,減少する,例文なし
decline,断る,She had to decline the invitation.
decompose,分解する,例文なし
decorum,礼儀正しさ,He behaved with decorum.
decorum,礼儀正しさ,He handled the situation with decorum.
decrease,減らす,We need to decrease our spending.
decrease,減らす,We need to decrease our spending.
decrease,減少する,The numbers decreased.
decry,非難する,He decried the government's policy.
decry,非難する,He decried the use of unethical tactics.
dedicate,専念する,He dedicated his life to his work.
dedicate,専念する,She dedicated herself to her work.
dedicate,捧げる,He dedicated his life to his work.
dedicate,捧げる,He dedicates his life to helping others.
dedicate,捧げる,She dedicated her life to her work.
deduce,推測する,From the evidence, we can deduce his motive.
deduce,推論する,I deduced the answer.
deduce,推論する,例文なし
deem,〜とみなす,The action was deemed necessary.
deem,〜とみなす,The company may deem your actions inappropriate.
deep,深い,A deep river.
deep,深い,The water is very deep.
deep,深い,例文なし
defalcate,横領する,He was accused of defalcating funds.
defalcate,横領する,He was accused of defalcating millions.
defamation,名誉毀損,He filed a lawsuit for defamation of character.
defamation,名誉毀損,He filed a lawsuit for defamation.
defame,中傷する,He was sued for defamation.
default,不履行,He was in default on his loan payments.
default,不履行,例文なし
defect,欠陥,例文なし
defective,欠陥のある,The product was defective, so I returned it.
defend,守る,Defend yourself.
defend,守る,He defended his position.
defend,守る,We must defend our rights.
defense,防衛,例文なし
defer,延期する,The decision was deferred until a later date.
defer,延期する,We deferred the meeting.
deference,尊敬,He showed deference to his boss.
deferential,敬意を表す,He was deferential to the senior managers.
defiance,反抗,The workers acted in defiance of the order.
deficiency,不足,A deficiency in the budget.
deficiency,不足,There is a deficiency of skilled workers.
deficiency,不足,There is a deficiency of workers.
deficient,欠陥のある,The report was deficient in detail.
deficit,赤字,The company is running a budget deficit.
deficit,赤字,The company is running a deficit.
deficit,赤字,例文なし
define,定義する,Can you define this term for me?
define,定義する,Define the term.
define,定義する,We need to define our project's goals clearly.
define,定義する,We need to define the project.
define,定義する,例文なし
definite,明確な,I need a definite answer.
definite,明確な,The answer is definite.
deflect,そらす,He tried to deflect the blame.
deform,変形させる,例文なし
defray,支払う,The company will defray all travel expenses.
defray,支払う,The company will defray the costs.
