term,meaning,example
a,1つの,A cat is in the garden.
a,ひとつの,例文なし
abandon,見捨てる,He had to abandon his car.
abandon,見捨てる,The company abandoned its old product line.
abandon,見捨てる,例文なし
abandon,捨てる,Don't abandon your dreams.
abandon,捨てる,The project was abandoned due to a lack of funding.
abandon,捨てる,例文なし
abate,和らぐ,The storm began to abate.
abate,和らぐ,The storm finally abated.
abbreviate,短縮する,You can abbreviate the word building to bldg..
aberrant,逸脱した,The company's aberrant behavior concerned investors.
aberration,逸脱,The low sales figure was an aberration from the usual trend.
aberration,逸脱,The unexpected increase in sales was a statistical aberration.
abet,唆す,He was accused of abetting a crime.
abeyance,一時停止,The project was held in abeyance until funding was secured.
abhor,嫌悪する,I abhor injustice and cruelty.
abide by,〜に従う,You must abide by the company regulations.
abide by,従う,You must abide by the terms of the agreement.
abide,従う,You must abide by the rules of the company.
abide,従う,You must abide by the rules.
abide,従う,You must abide by the terms of the contract.
ability,能力,She has a great ability to learn.
ability,能力,She has the ability to speak three languages.
ability,能力,She has the ability to learn quickly.
ability,能力,例文なし
abject,惨めな,The refugees were living in abject poverty.
abjuration,放棄,He signed a formal abjuration of his citizenship.
abjure,放棄する,He was forced to abjure his beliefs.
able,〜できる,Are you able to help me?
able,〜できる,You will be able to find the information on our website.
able,〜できる,例文なし
able,できる,He is able to lift the box.
ablution,清め,The ritual requires a symbolic ablution.
abnegate,拒否する,He chose to abnegate his duties.
abnegation,自己犠牲,The project's success required the team's complete abnegation of personal time.
abnormal,異常な,The stock price showed an abnormal increase.
abolish,廃止する,The company decided to abolish the old policy.
abolish,廃止する,The company decided to abolish the outdated policy.
abolish,廃止する,The company plans to abolish the old system.
abolish,廃止する,The government abolished the old law.
abound,豊富である,Opportunities abound in this new market.
abound,豊富にある,Opportunities abound for young professionals in this industry.
about,〜について,Tell me about your job.
about,〜について,The presentation is about new marketing strategies.
about,〜について,例文なし
about,およそ,The meeting will start in about ten minutes.
above,〜の上に,The book is above the shelf.
above,〜の上に,The book is on the shelf above the table.
above,〜の上に,例文なし
abrade,すり減らす,The constant friction will abrade the surface.
abroad,海外で,He plans to work abroad next year.
abroad,海外に,例文なし
abrogate,廃止する,The board moved to abrogate the old contract.
abrogate,廃止する,The government decided to abrogate the treaty.
abrogate,廃止する,The government plans to abrogate the law.
abrogate,廃止する,The legislature voted to abrogate the outdated law.
abrogate,廃止する,The new law will abrogate the old one.
abruptly,突然,The meeting ended abruptly due to a power outage.
abscond,逃亡する,The accountant absconded with the company's funds.
abscond,逃亡する,The manager absconded with the company funds.
absence,不在,His absence was noted.
absent,欠席の,He was absent from the meeting.
absent,欠席の,例文なし
absent,不在の,He was absent from the meeting due to an illness.
absent,不在の,He was absent from the meeting.
absenteeism,欠勤率,The manager is concerned about the high absenteeism.
absolute,絶対的な,The project needs your absolute attention.
absolute,絶対的な,This is the absolute best solution.
absolute,絶対的な,This is the absolute truth.
absolve,免除する,The court absolved him of all blame.
absorb,吸収する,The company will absorb the costs.
absorb,吸収する,The sponge absorbed the water.
abstain,棄権する,He chose to abstain from the vote.
abstain,控える,I will abstain from voting.
abstinence,禁欲,Abstinence from alcohol is required for the program.
abstract,抽象的な,The report was too abstract to be useful.
abstract,抽象的な,例文なし
abstruse,難解な,The legal document was filled with abstruse jargon.
abstruse,難解な,The philosophical text was too abstruse for me.
absurd,不合理な,The cost estimate was absurd.
abundant,豊富な,The area has an abundant supply of natural resources.
abundant,豊富な,The country has abundant natural resources.
abundant,豊富な,The country has an abundant supply of natural resources.
abut,隣接する,The two properties abut each other.
abyss,深淵,The company stared into the financial abyss.
academic,学術的な,例文なし
accede,応じる,The board will accede to the manager's request.
accede,応じる,The company will accede to the union's demands.
accede,応じる,The company will accede to their demands.
accede,応じる,The company will not accede to the demands of the union.
accelerate,加速させる,We need to accelerate the project timeline.
accelerate,加速させる,We need to accelerate the process.
accelerate,加速させる,We need to accelerate the production process.
accept,受け入れる,I accept your offer.
accept,受け入れる,I accept your proposal.
accept,受け入れる,例文なし
access,アクセス,I need to access my files.
access,アクセス,I need to get access to the database.
access,アクセス,Please use your key card to access the building.
access,アクセス,例文なし
access,アクセスする,I can't access the website.
access,利用する,例文なし
accessible,利用しやすい,The information is easily accessible.
accessible,利用可能な,The data is easily accessible.
accessory,付属品,The product comes with several accessories.
accident,事故,He had a car accident.
acclaim,称賛,The new product received critical acclaim.
acclaim,賞賛する,The new product was acclaimed by critics.
acclimate,慣れる,It takes time to acclimate to a new work environment.
acclimate,順応させる,It took time for the new employees to acclimate to the corporate culture.
accolade,賞賛,He received a lot of accolades for his work.
accolade,賞賛,She received numerous accolades for her work.
accolade,賞賛,The product received numerous accolades for its design.
accommodate,収容する,The conference room can accommodate 50 people.
accommodate,収容する,The conference room can accommodate 50 people.
accommodate,収容する,The hotel can accommodate up to 300 guests.
accommodate,収容する,The new facility can accommodate over 500 employees.
accommodate,収容する,The room can accommodate 20 people.
accommodating,親切な,He is very accommodating to his clients' needs.
accompany,同行する,I will accompany you to the station.
accompany,同行する,The CEO will accompany the delegation on the trip.
accompany,同行する,The CEO will accompany the sales team on the trip.
accompany,同行する,例文なし
accomplice,共犯者,He was an accomplice in the crime.
accomplish,達成する,We accomplished our goal.
accomplish,達成する,We accomplished our goals.
accomplish,達成する,We hope to accomplish this goal by the end of the month.
accord,一致,His actions are in accord with his words.
accord,一致する,His actions do not accord with his words.
accordance,一致,The report was prepared in strict accordance with the guidelines.
according to,〜によると,According to the report, sales have increased.
according,〜によれば,例文なし
accost,声をかける,A salesperson accosted me in the store.
accost,声をかける,He accosted me in the street.
account,アカウント,I need to create a new account.
account,アカウント,Please create a new account.
account,口座,Please check your bank account.
account,口座,例文なし
account,説明,Please give an account of what happened.
account,説明する,He couldn't account for the missing money.
accountable,責任がある,Managers are accountable for their team's performance.
accountable,説明責任がある,Managers are accountable for their team's performance.
accountable,説明責任のある,As the manager, you are accountable for the team's performance.
accountant,会計士,例文なし
accredit,認定する,The program is accredited by the state.
accretion,付着,The accretion of barnacles on the ship's hull.
accrue,生じる,Interest will accrue on the loan.
accrue,生じる,Interest will accrue on the savings account.
accrue,生じる,Interest will accrue on your savings account.
accrue,生じる,Interest will accrue on your savings.
accrue,生じる,例文なし
accumulate,蓄積する,He accumulated a lot of wealth.
accumulate,蓄積する,例文なし
accurate,正確な,Please provide accurate data.
accurate,正確な,The report contains accurate data.
accurate,正確な,The report contains accurate data.
accurate,正確な,The report is not accurate.
accurate,正確な,例文なし
accuse,非難する,He was accused of a mistake.
accuse,非難する,He was accused of stealing.
achievable,達成可能な,The goals we set are achievable.
achieve,達成する,She achieved her sales target this quarter.
achieve,達成する,She achieved her dream.
achieve,達成する,She worked hard to achieve her goals.
achieve,達成する,We can achieve our goals through hard work.
achieve,達成する,例文なし
acid,酸,例文なし
acknowledge,認める,He acknowledged his mistake.
acknowledge,認める,I acknowledge my mistake.
acknowledge,認める,I would like to acknowledge your hard work.
acknowledge,認める,The company acknowledged the customer's complaint.
acknowledge,認める,例文なし
acquaint,精通させる,I will acquaint you with the new system.
acquaint,精通させる,Please acquaint yourself with the new company policies.
acquiesce,黙認する,She acquiesced to his demands.
acquiesce,黙認する,She will never acquiesce to such an unfair request.
acquire,獲得する,例文なし
acquire,取得する,The company acquired a smaller firm last year.
acquire,取得する,The company acquired a new patent.
acquire,習得する,He wants to acquire new skills.
acquire,買収する,The corporation plans to acquire a smaller tech firm.
acquisition,買収,The company's acquisition was a success.
acquisition,買収,例文なし
acquisitive,欲しがる,He has an acquisitive nature.
acquit,無罪とする,The jury will acquit the defendant.
acrimonious,辛辣な,The debate turned acrimonious after the financial report was released.
acrimonious,辛辣な,They had an acrimonious debate.
across,〜を横切って,He walked across the street.
across,〜を横切って,Our office is across the street from the park.
across,〜を横切って,例文なし
act,行動する,Please act quickly.
act,行動する,The manager decided to act quickly to solve the problem.
act,行動する,You need to act now.
act,行動する,例文なし
action,行動,His actions speak louder than words.
action,行動,It's time for action.
action,行動,例文なし
activate,活性化させる,We need to activate the new system.
activate,活性化する,例文なし
activate,有効化する,You need to activate your license.
active,活動的な,He is a very active person.
active,活動的な,We are looking for an active member for our team.
activity,活動,The team-building activity was a great success.
actual,実際の,This is the actual product.
actually,実際に,例文なし
acuity,鋭さ,He has a great intellectual acuity.
acuity,鋭さ,Her business acuity allowed her to foresee market trends.
acumen,鋭い洞察力,He has a great business acumen.
acumen,鋭い洞察力,He has a keen business acumen.
ad,広告,The ad campaign was a success.
adage,格言,The old adage time is money is still relevant.
adamant,断固とした,She was adamant that she would not change her mind.
adapt,適応する,Employees must adapt to the new work environment.
adapt,適応する,She can adapt to any situation.
adapt,適応する,例文なし
adapter,アダプター,I need a new power adapter.
add-on,追加機能,The new add-on enhances performance.
add,加える,Add some sugar to the coffee.
add,加える,Please add my name to the list.
add,加える,Please add some sugar to the coffee.
add,加える,例文なし
addendum,追加,An addendum to the contract was added.
address,アドレス,What's your email address?
address,住所,What is the shipping address for this order?
address,住所,What's your address?
address,住所,例文なし
address,対処する,We need to address this issue immediately.
adduce,例証する,He adduced evidence to support his argument.
adequate,十分な,The food supply is adequate.
adequate,十分な,We have an adequate supply of materials.
adequate,適切な,The funding is not adequate.
adequate,適切な,例文なし
adhere to,〜に固執する,Please adhere to the safety rules.
adhere,固守する,Please adhere to the guidelines.
adhere,固守する,We must adhere to the strict safety regulations.
adhere,固守する,We must adhere to the original plan.
adhere,固守する,We must adhere to the rules.
adhere,固守する,We must adhere to the safety guidelines.
adjacent,隣接した,Our office is adjacent to the conference room.
adjacent,隣接した,The building is adjacent to the park.
adjacent,隣接した,例文なし
adjourn,延期する,The meeting was adjourned until next week.
adjourn,延期する,The meeting was adjourned until tomorrow.
adjourn,休会する,The meeting was adjourned until tomorrow.
adjudicate,裁定する,An independent body was appointed to adjudicate the dispute.
adjudicate,裁定する,The court will adjudicate the dispute.
adjust,調整する,Please adjust the volume.
adjust,調整する,The settings of the machine need to be adjusted.
adjust,調整する,We need to adjust the budget for this project.
adjust,調整する,You can adjust the brightness of the screen.
adjust,調整する,You need to adjust the settings.
adjust,調整する,You need to adjust the volume.
adjust,調整する,例文なし
admin,管理者,You need admin rights to install the software.
administer,管理する,He was hired to administer the project.
administer,管理する,She administers the company's website.
administrate,管理する,例文なし
administration,管理,The administration department handles payroll.
administration,管理,例文なし
admire,賞賛する,I admire her professionalism.
admire,賞賛する,I admire her work ethic.
admission,入場,Admission is free.
admission,入場,The admission fee for the museum is 10 dollars.
admit,認める,He admitted his mistake.
admit,認める,I admit I was wrong.
admit,認める,例文なし
admonish,忠告する,She admonished him for his careless behavior.
admonish,忠告する,The manager had to admonish the employee for being late.
admonition,警告,He received an admonition for his behavior.
adobe,アドビ,I am an expert in Adobe Illustrator.
adobe,アドビ,I use Adobe Photoshop.
adopt,採用する,The board decided to adopt the new strategy.
adopt,採用する,The company adopted a new policy.
adopt,採用する,The company will adopt a new software system.
adopt,採用する,They decided to adopt a new strategy.
adroit,器用な,He is adroit at handling difficult negotiations.
adroit,器用な,He is adroit at handling difficult situations.
adroit,器用な,She is an adroit negotiator.
adulation,賛美,He received the adulation of his fans.
adult,大人,He is an adult now.
adult,大人,例文なし
adulterate,混ぜ物をする,The food was adulterated with cheap ingredients.
adulterate,混ぜ物をする,The product was adulterated with cheap ingredients.
adulterate,混ぜ物をする,The product was adulterated with cheaper materials.
adumbrate,大まかに述べる,He adumbrated his plans for the future.
adumbrate,大まかに述べる,The CEO will adumbrate the company's new strategy at the meeting.
advance,進む,The company is advancing in the market.
advance,進む,The project is advancing well.
advance,進む,The troops advanced toward the enemy.
advance,前進する,The project has advanced to the next stage.
advantage,利点,Having a good command of English is a great advantage.
advantage,利点,The new feature gives us a competitive advantage.
advantage,利点,This feature has an advantage.
advantage,利点,This product has an advantage over its competitors.
advantage,利点,What is the advantage of this approach?
adventure,冒険,It was an amazing adventure.
adversary,敵,Our main adversary in the market is a global company.
adverse,不利な,The company faced adverse market conditions.
adverse,不利な,The company faced adverse conditions.
adverse,不利な,The company faced adverse economic conditions.
advert,広告,例文なし
advertise,宣伝する,We need to advertise our new product.
advertise,宣伝する,We should advertise our new product online.
advertisement,広告,I saw an advertisement for a new coffee shop.
advertisement,広告,The advertisement was very effective.
advice,助言,I need some advice on my career.
advice,助言,I need some advice.
advice,助言,I need your advice.
advise,助言する,He advised me to see a doctor.
advise,助言する,He advised me to study more.
advise,助言する,My boss advised me to take the training.
advocacy,擁護,The organization is known for its consumer advocacy.
advocate,主張する,He advocates for human rights.
advocate,提唱する,She advocates for renewable energy.
advocate,提唱する,例文なし
advocate,提唱者,He is a strong advocate for environmental protection.
aegis,保護,The project was conducted under the aegis of the government.
aerate,空気を送る,We need to aerate the soil.
aesthetic,美的な,The building has a great aesthetic appeal.
aesthetics,美学,The design prioritizes aesthetics over function.
affable,愛想の良い,He is an affable and approachable manager.
affable,愛想の良い,He is an affable person.
affair,事柄,This is a business affair.
affair,事柄,This is a private affair.
affect,影響する,The rain will affect the game.
affect,影響する,例文なし
affect,影響を与える,The new policy will affect all employees.
affect,影響を与える,The rain will affect our plans.
affected,気取った,His affected accent was annoying.
affiliate,提携する,The company is affiliated with a major university.
affiliate,提携する,The company will affiliate with a large marketing firm.
affinity,親近感,I feel a strong affinity for my colleagues.
affinity,親近感,I feel an affinity for her.
affirm,断言する,I can affirm that this is true.
affirm,断言する,The manager affirmed that the project was on track.
affirmation,断言,He provided an affirmation of his commitment.
affix,添付する,Please affix your signature to the bottom of the form.
afflict,苦しめる,The disease afflicts many people.
affliction,苦悩,The country suffers from the affliction of poverty.
affluent,裕福な,He comes from an affluent family.
affluent,裕福な,The affluent neighborhood has many large homes.
afford,〜する余裕がある,I can't afford to buy a new computer right now.
afford,〜する余裕がある,I can't afford a new car.
afford,〜する余裕がある,I can't afford to buy a new car.
affordable,手頃な,The product is affordable.
affordable,手頃な,This service is both high-quality and affordable.
afraid,恐れて,I am afraid of heights.
afraid,恐れて,I am afraid of snakes.
after,〜の後,Let's meet after work.
after,〜の後,We will go to the park after lunch.
after,〜の後,例文なし
afternoon,午後,I'll see you in the afternoon.
again,再び,Please say it again.
again,再び,Please say that again.
again,再び,例文なし
against,〜に反対して,I am against the new rule.
against,〜に反対して,They are against the new law.
against,〜に反対して,例文なし
age,年齢,What is your age?
age,年齢,例文なし
agency,代理店,We hired a digital marketing agency.
agency,代理店,例文なし
agenda,議題,What is on the agenda for today's meeting?
agenda,議題,What's on the agenda for today's meeting?
agenda,議題,What's on the agenda for today's meeting?
agenda,議題,例文なし
agent,代理人,例文なし
agglomeration,集合,The city is a massive agglomeration of different cultures.
aggrandize,拡大する,He sought to aggrandize his reputation.
aggravate,悪化させる,The loud noise aggravated his headache.
aggravate,悪化させる,The new rule will aggravate the problem.
aggregate,合計,The aggregate of all sales is 1 million dollars.
aggregate,合計する,We need to aggregate the sales data.
aggregate,集計する,例文なし
aggregator,アグリゲーター,A news aggregator app.
agile,アジャイル,We use an agile approach to project management.
ago,〜前に,He left an hour ago.
ago,〜前に,例文なし
agree,同意する,I agree with you.
agree,同意する,We agreed on the terms.
agree,同意する,We all agree on the terms of the contract.
agree,同意する,例文なし
agreement,合意,We have reached a final agreement.
agreement,合意,We reached an agreement.
agreement,合意,例文なし
agreement,同意,We have an agreement.
ahead,前方に,He is ahead of me.
ahead,前方に,He is walking ahead of me.
ahead,前方に,We are ahead of schedule.
ahead,前方に,例文なし
aid,援助,The company provides financial aid.
aid,援助する,He aided the company in its time of need.
aid,助け,He came to my aid.
aid,助ける,例文なし
aim,目指す,We aim to finish the project on time.
aim,目的,My aim is to become a doctor.
aim,目的,What is your aim in life?
air,空気,The air conditioning is not working.
air,空気,The air is clean here.
air,空気,The air is fresh here.
air,空気,例文なし
airport,空港,I am going to the airport.
alacrity,機敏さ,He accepted the new project with alacrity.
alacrity,機敏さ,He accepted the offer with alacrity.
alacrity,機敏さ,He responded with great alacrity to the client's request.
alacrity,機敏さ,He responded with great alacrity to the request.
albeit,〜にもかかわらず,例文なし
algorithm,アルゴリズム,The search engine's algorithm.
alight,降りる,The passengers will alight from the train.
align,合わせる,The company's goals align with my personal values.
alive,生きている,Is he still alive?
alive,生きている,Is the plant still alive?
alkaline,アルカリ性の,例文なし
all,すべての,All employees are required to attend the meeting.
all,すべての,All the students passed the test.
all,すべての,例文なし
allege,主張する,He alleges that he is innocent.
alleviate,軽減する,New policies were implemented to alleviate the workload.
alleviate,軽減する,The medicine will alleviate the pain.
alleviate,軽減する,The medicine will help to alleviate the pain.
allocate,割り当てる,The manager will allocate resources to each team.
allocate,割り当てる,The project manager will allocate resources to each task.
allocate,割り当てる,We need to allocate funds for the new project.
allocate,割り当てる,We need to allocate our budget wisely.
allocate,割り当てる,We need to allocate resources.
allocate,割り当てる,例文なし
allocution,演説,The CEO's allocution addressed the company's future.
allot,割り当てる,Each department was allotted a specific budget.
allot,割り当てる,Each person will be allotted a specific task.
allotment,割り当て,Each department was given an allotment of funds.
allow,許す,My parents allow me to go out.
allow,許す,例文なし
allow,許可する,My parents allow me to go.
allow,許可する,Photography is not allowed in the gallery.
allowance,手当,He gets a travel allowance.
alloy,合金,例文なし
allude,それとなく言う,He alluded to the potential layoffs.
allude,それとなく言う,He alluded to the problem.
almost,ほとんど,I am almost finished with the report.
almost,ほとんど,I am almost ready.
almost,ほとんど,I'm almost finished.
almost,ほとんど,例文なし
alone,1人で,I am alone at home.
alone,1人で,She traveled to Europe alone.
alone,一人で,He lives alone.
alone,一人で,例文なし
along,〜に沿って,Walk along the river to find the building.
along,〜に沿って,Walk along the street.
along,〜に沿って,We walked along the river.
along,〜に沿って,例文なし
already,すでに,I have already sent the email.
already,すでに,I have already eaten.
already,すでに,I have already finished my homework.
already,すでに,例文なし
also,〜もまた,He is a manager and also a great leader.
also,〜もまた,He is also a teacher.
also,また,She also wants to come.
also,また,例文なし
alter,変える,We need to alter the plan.
alter,変える,例文なし
alter,変更する,We had to alter our plan due to the weather.
alter,変更する,We need to alter the design to meet the requirements.
altercation,口論,He had an altercation with his boss.
altercation,口論,There was a minor altercation between the two colleagues.
alternative,代替の,There is no alternative.
alternative,代替の,例文なし
alternative,代替案,There is no alternative but to proceed with the plan.
alternative,代替案,We need to find an alternative solution.
although,〜にもかかわらず,Although it was cold, we went out.
although,〜にもかかわらず,Although it was raining, we went for a walk.
although,〜にもかかわらず,例文なし
altruism,利他主義,His altruism was evident in his charity work.
